{
  "schema_version": 1,
  "project": {
    "project_id": "PSR-2026-010",
    "slug": "ai-sdlc-haider-lesa",
    "title": "AI Software Development Life Cycle - Haider Lesa",
    "status": "source-package",
    "catalog_state": "reviewed-minimal",
    "created": "2026-07-24",
    "updated": "2026-08-03",
    "source_locator": {
      "file": "README.md",
      "locator_type": "heading",
      "value": "# AI Software Development Life Cycle — Haider Lesa"
    }
  },
  "citations": [
    {
      "source_id": "S-REPORT",
      "project_id": "PSR-2026-010",
      "publisher": "ProcessSmith research",
      "url": "https://github.com/steverea1984-boop/processsmith-research/blob/main/ai-sdlc-haider-lesa/README.md",
      "accessed": "2026-09-15",
      "evidence_type": "prior-synthesis",
      "source_locator": {
        "file": "README.md",
        "locator_type": "heading",
        "value": "# AI Software Development Life Cycle — Haider Lesa"
      }
    }
  ],
  "entities": [],
  "relations": [],
  "mentions": [],
  "tools": [],
  "claims": [
    {
      "record_id": "PSR-2026-010-claim-summary",
      "project_id": "PSR-2026-010",
      "updated": "2026-08-03",
      "source_ids": [
        "S-REPORT"
      ],
      "source_locator": {
        "file": "README.md",
        "locator_type": "heading",
        "value": "# AI Software Development Life Cycle — Haider Lesa"
      },
      "text": "This package preserves source material about an AI software-development lifecycle; it is not yet a fully verified ProcessSmith recommendation.",
      "claimant": "ProcessSmith research report",
      "assessment_status": "needs-verification",
      "confidence": "medium",
      "verified_on": "2026-09-15"
    }
  ],
  "price_observations": [],
  "comparisons": []
}
